{"aprovados":224,"casos_executados":19,"checks":226,"codigo_sha256":{"aceite":"e363aee993280826b31983693d78b58c55914c427fa046ce41c0b93e94ca86d3","analisador":"19dc70bc75c166d0f921d8d29045cf627ae585ea9d4a40c87efa6d5613132fb3","executor_corpus":"e993d5ecf2ff1294265d77e413cd09f91be81510c018760f50a565298c8852bc","gerador":"60bbf82b4d441ee38fd1d12de969ab571924f53034e0582f3d3e4dae25f42a23"},"corpus_sha256":"c5cfe825780406fa92c9a154ac0f3897bdb6484010d5392535dcca15597af91e","falhas":2,"resultados":[{"caminho":["telemetria","module_coverage_gates","turn_and_session_orchestration","activity_units"],"case_id":"preparo_direto_completo","check_id":"direto-turn_and_session_orchestration-atividades","esperado":1,"observado":1,"observado_disponivel":true,"ok":true,"tipo":"gabarito","unidade_avaliativa":"atividade_modular"},{"caminho":["telemetria","module_coverage_gates","turn_and_session_orchestration","complete_receipts"],"case_id":"preparo_direto_completo","check_id":"direto-turn_and_session_orchestration-completos","esperado":1,"observado":1,"observado_disponivel":true,"ok":true,"tipo":"gabarito","unidade_avaliativa":"recibo_modular"},{"caminho":["telemetria","module_coverage_gates","turn_and_session_orchestration","missing_receipts"],"case_id":"preparo_direto_completo","check_id":"direto-turn_and_session_orchestration-ausentes","esperado":0,"observado":0,"observado_disponivel":true,"ok":true,"tipo":"gabarito","unidade_avaliativa":"atividade_modular"},{"caminho":["telemetria","module_coverage_gates","scene_world_projection","activity_units"],"case_id":"preparo_direto_completo","check_id":"direto-scene_world_projection-atividades","esperado":1,"observado":1,"observado_disponivel":true,"ok":true,"tipo":"gabarito","unidade_avaliativa":"atividade_modular"},{"caminho":["telemetria","module_coverage_gates","scene_world_projection","complete_receipts"],"case_id":"preparo_direto_completo","check_id":"direto-scene_world_projection-completos","esperado":1,"observado":1,"observado_disponivel":true,"ok":true,"tipo":"gabarito","unidade_avaliativa":"recibo_modular"},{"caminho":["telemetria","module_coverage_gates","scene_world_projection","missing_receipts"],"case_id":"preparo_direto_completo","check_id":"direto-scene_world_projection-ausentes","esperado":0,"observado":0,"observado_disponivel":true,"ok":true,"tipo":"gabarito","unidade_avaliativa":"atividade_modular"},{"caminho":["telemetria","module_coverage_gates","sidequest_authoring","activity_units"],"case_id":"preparo_direto_completo","check_id":"direto-sidequest_authoring-atividades","esperado":1,"observado":1,"observado_disponivel":true,"ok":true,"tipo":"gabarito","unidade_avaliativa":"atividade_modular"},{"caminho":["telemetria","module_coverage_gates","sidequest_authoring","complete_receipts"],"case_id":"preparo_direto_completo","check_id":"direto-sidequest_authoring-completos","esperado":1,"observado":1,"observado_disponivel":true,"ok":true,"tipo":"gabarito","unidade_avaliativa":"recibo_modular"},{"caminho":["telemetria","module_coverage_gates","sidequest_authoring","missing_receipts"],"case_id":"preparo_direto_completo","check_id":"direto-sidequest_authoring-ausentes","esperado":0,"observado":0,"observado_disponivel":true,"ok":true,"tipo":"gabarito","unidade_avaliativa":"atividade_modular"},{"caminho":["telemetria","module_coverage_gates","sidequest_lifecycle","activity_units"],"case_id":"preparo_direto_completo","check_id":"direto-sidequest_lifecycle-atividades","esperado":1,"observado":1,"observado_disponivel":true,"ok":true,"tipo":"gabarito","unidade_avaliativa":"atividade_modular"},{"caminho":["telemetria","module_coverage_gates","sidequest_lifecycle","complete_receipts"],"case_id":"preparo_direto_completo","check_id":"direto-sidequest_lifecycle-completos","esperado":1,"observado":1,"observado_disponivel":true,"ok":true,"tipo":"gabarito","unidade_avaliativa":"recibo_modular"},{"caminho":["telemetria","module_coverage_gates","sidequest_lifecycle","missing_receipts"],"case_id":"preparo_direto_completo","check_id":"direto-sidequest_lifecycle-ausentes","esperado":0,"observado":0,"observado_disponivel":true,"ok":true,"tipo":"gabarito","unidade_avaliativa":"atividade_modular"},{"caminho":["telemetria","module_coverage_gates","causal_narrative_routing","activity_units"],"case_id":"preparo_direto_completo","check_id":"direto-causal_narrative_routing-atividades","esperado":1,"observado":1,"observado_disponivel":true,"ok":true,"tipo":"gabarito","unidade_avaliativa":"atividade_modular"},{"caminho":["telemetria","module_coverage_gates","causal_narrative_routing","complete_receipts"],"case_id":"preparo_direto_completo","check_id":"direto-causal_narrative_routing-completos","esperado":1,"observado":1,"observado_disponivel":true,"ok":true,"tipo":"gabarito","unidade_avaliativa":"recibo_modular"},{"caminho":["telemetria","module_coverage_gates","causal_narrative_routing","missing_receipts"],"case_id":"preparo_direto_completo","check_id":"direto-causal_narrative_routing-ausentes","esperado":0,"observado":0,"observado_disponivel":true,"ok":true,"tipo":"gabarito","unidade_avaliativa":"atividade_modular"},{"caminho":["telemetria","module_coverage_gates","npc_continuity_and_social_behavior","activity_units"],"case_id":"preparo_direto_completo","check_id":"direto-npc_continuity_and_social_behavior-atividades","esperado":1,"observado":1,"observado_disponivel":true,"ok":true,"tipo":"gabarito","unidade_avaliativa":"atividade_modular"},{"caminho":["telemetria","module_coverage_gates","npc_continuity_and_social_behavior","complete_receipts"],"case_id":"preparo_direto_completo","check_id":"direto-npc_continuity_and_social_behavior-completos","esperado":1,"observado":1,"observado_disponivel":true,"ok":true,"tipo":"gabarito","unidade_avaliativa":"recibo_modular"},{"caminho":["telemetria","module_coverage_gates","npc_continuity_and_social_behavior","missing_receipts"],"case_id":"preparo_direto_completo","check_id":"direto-npc_continuity_and_social_behavior-ausentes","esperado":0,"observado":0,"observado_disponivel":true,"ok":true,"tipo":"gabarito","unidade_avaliativa":"atividade_modular"},{"caminho":["telemetria","module_coverage_gates","context_and_memory","activity_units"],"case_id":"preparo_direto_completo","check_id":"direto-context_and_memory-atividades","esperado":1,"observado":1,"observado_disponivel":true,"ok":true,"tipo":"gabarito","unidade_avaliativa":"atividade_modular"},{"caminho":["telemetria","module_coverage_gates","context_and_memory","complete_receipts"],"case_id":"preparo_direto_completo","check_id":"direto-context_and_memory-completos","esperado":1,"observado":1,"observado_disponivel":true,"ok":true,"tipo":"gabarito","unidade_avaliativa":"recibo_modular"},{"caminho":["telemetria","module_coverage_gates","context_and_memory","missing_receipts"],"case_id":"preparo_direto_completo","check_id":"direto-context_and_memory-ausentes","esperado":0,"observado":0,"observado_disponivel":true,"ok":true,"tipo":"gabarito","unidade_avaliativa":"atividade_modular"},{"caminho":["telemetria","module_coverage_gates","turn_and_session_orchestration","activity_units"],"case_id":"leitura_e_preparo_separados","check_id":"separado-turn_and_session_orchestration-atividades","esperado":1,"observado":1,"observado_disponivel":true,"ok":true,"tipo":"gabarito","unidade_avaliativa":"atividade_modular"},{"caminho":["telemetria","module_coverage_gates","turn_and_session_orchestration","complete_receipts"],"case_id":"leitura_e_preparo_separados","check_id":"separado-turn_and_session_orchestration-completos","esperado":1,"observado":1,"observado_disponivel":true,"ok":true,"tipo":"gabarito","unidade_avaliativa":"recibo_modular"},{"caminho":["telemetria","module_coverage_gates","turn_and_session_orchestration","missing_receipts"],"case_id":"leitura_e_preparo_separados","check_id":"separado-turn_and_session_orchestration-ausentes","esperado":0,"observado":0,"observado_disponivel":true,"ok":true,"tipo":"gabarito","unidade_avaliativa":"atividade_modular"},{"caminho":["telemetria","module_coverage_gates","scene_world_projection","activity_units"],"case_id":"leitura_e_preparo_separados","check_id":"separado-scene_world_projection-atividades","esperado":1,"observado":1,"observado_disponivel":true,"ok":true,"tipo":"gabarito","unidade_avaliativa":"atividade_modular"},{"caminho":["telemetria","module_coverage_gates","scene_world_projection","complete_receipts"],"case_id":"leitura_e_preparo_separados","check_id":"separado-scene_world_projection-completos","esperado":1,"observado":1,"observado_disponivel":true,"ok":true,"tipo":"gabarito","unidade_avaliativa":"recibo_modular"},{"caminho":["telemetria","module_coverage_gates","scene_world_projection","missing_receipts"],"case_id":"leitura_e_preparo_separados","check_id":"separado-scene_world_projection-ausentes","esperado":0,"observado":0,"observado_disponivel":true,"ok":true,"tipo":"gabarito","unidade_avaliativa":"atividade_modular"},{"caminho":["telemetria","module_coverage_gates","sidequest_authoring","activity_units"],"case_id":"leitura_e_preparo_separados","check_id":"separado-sidequest_authoring-atividades","esperado":1,"observado":1,"observado_disponivel":true,"ok":true,"tipo":"gabarito","unidade_avaliativa":"atividade_modular"},{"caminho":["telemetria","module_coverage_gates","sidequest_authoring","complete_receipts"],"case_id":"leitura_e_preparo_separados","check_id":"separado-sidequest_authoring-completos","esperado":1,"observado":1,"observado_disponivel":true,"ok":true,"tipo":"gabarito","unidade_avaliativa":"recibo_modular"},{"caminho":["telemetria","module_coverage_gates","sidequest_authoring","missing_receipts"],"case_id":"leitura_e_preparo_separados","check_id":"separado-sidequest_authoring-ausentes","esperado":0,"observado":0,"observado_disponivel":true,"ok":true,"tipo":"gabarito","unidade_avaliativa":"atividade_modular"},{"caminho":["telemetria","module_coverage_gates","sidequest_lifecycle","activity_units"],"case_id":"leitura_e_preparo_separados","check_id":"separad